{
  "schema_version": 1,
  "id": "soku-pr-site-control-plane-v1",
  "source": "github:Soku-JINSEOK/Soku-Convention-Boilerplate/soku/providers/soku-pr-site-control-plane-v1",
  "provider_api_version": "1",
  "provider_schema_version": "1",
  "compatible_soku": ">=0.1.2 <1.0.0",
  "configuration_schema_hash": "e940eb5a86c2904735602f8f807bce2f94766d701e87cf9bd336543744fae53d",
  "configuration_hash": "ecef570d386066d417ed3203dc3cedbba99fc0a49fa3dbac7e26e189ae95ced6",
  "compatible_profiles": [
    "bootstrap",
    "scaled",
    "standard"
  ],
  "outputs": [
    {
      "template": "templates/control-plane-provider.yml",
      "path": ".github/control-plane-provider.yml",
      "content_mode": "text"
    }
  ]
}
